{
  "$schema": "https://json-schema.org/draft/2020-12/schema",
  "$id": "https://agent-runtime.local/schemas/chat-turn-request.schema.json",
  "title": "ChatTurnRequest",
  "type": "object",
  "required": ["protocol_version", "provider", "model", "messages"],
  "properties": {
    "protocol_version": { "const": "agent.v1" },
    "turn_id": { "type": ["string", "null"], "minLength": 1 },
    "surface": { "type": ["string", "null"], "minLength": 1 },
    "mode": { "type": ["string", "null"], "minLength": 1 },
    "session_id": { "type": ["string", "null"], "minLength": 1 },
    "thread_id": { "type": ["string", "null"], "minLength": 1 },
    "agent_id": { "type": ["string", "null"], "minLength": 1 },
    "provider": { "type": "string", "minLength": 1 },
    "model": { "type": "string", "minLength": 1 },
    "messages": {
      "type": "array",
      "minItems": 1,
      "items": { "$ref": "#/$defs/llm_message" }
    },
    "temperature": { "type": ["number", "null"], "minimum": 0 },
    "max_output_tokens": { "type": ["integer", "null"], "minimum": 1 },
    "tools": {
      "type": "array",
      "items": { "$ref": "#/$defs/tool_spec" },
      "default": []
    },
    "context_blocks": {
      "type": "array",
      "items": { "$ref": "#/$defs/context_block" },
      "default": []
    },
    "metadata": { "type": "object", "default": {} },
    "context_policy": {
      "$ref": "#/$defs/context_policy",
      "default": {
        "max_input_tokens": 128000,
        "reserve_output_tokens": 4096,
        "preserve_recent_messages": 12,
        "compact_when_over_budget": true
      }
    },
    "max_tool_rounds": { "type": "integer", "minimum": 1, "default": 4 },
    "tool_execution": {
      "type": "string",
      "enum": ["runtime", "client"],
      "default": "runtime"
    }
  },
  "additionalProperties": false,
  "$defs": {
    "llm_message": {
      "type": "object",
      "required": ["role", "content"],
      "properties": {
        "role": {
          "type": "string",
          "enum": ["system", "user", "assistant", "tool"]
        },
        "content": true,
        "name": { "type": ["string", "null"] },
        "metadata": { "type": "object", "default": {} }
      },
      "additionalProperties": false
    },
    "tool_spec": {
      "type": "object",
      "required": ["name", "description", "input_schema", "risk"],
      "properties": {
        "name": { "type": "string", "minLength": 1 },
        "description": { "type": "string" },
        "input_schema": { "type": "object" },
        "output_schema": { "type": ["object", "null"] },
        "risk": {
          "type": "string",
          "enum": ["read_only", "low", "medium", "high"]
        },
        "replay_policy": {
          "type": "string",
          "enum": ["safe_retry", "idempotent", "at_most_once"],
          "default": "at_most_once"
        },
        "metadata": { "type": "object", "default": {} }
      },
      "additionalProperties": false
    },
    "context_policy": {
      "type": "object",
      "required": [
        "max_input_tokens",
        "reserve_output_tokens",
        "preserve_recent_messages",
        "compact_when_over_budget"
      ],
      "properties": {
        "max_input_tokens": { "type": "integer", "minimum": 1 },
        "reserve_output_tokens": { "type": "integer", "minimum": 0 },
        "preserve_recent_messages": { "type": "integer", "minimum": 0 },
        "compact_when_over_budget": { "type": "boolean" }
      },
      "additionalProperties": false
    },
    "context_block": {
      "type": "object",
      "required": ["block_id", "kind", "source", "content_hash"],
      "properties": {
        "block_id": { "type": "string", "minLength": 1 },
        "kind": {
          "type": "string",
          "enum": [
            "runtime_instructions",
            "agent_instructions",
            "command_instructions",
            "profile",
            "memory",
            "compaction_summary",
            "message",
            "tool_schema",
            "resource",
            "metadata"
          ]
        },
        "source": { "type": "string", "minLength": 1 },
        "priority": { "type": "integer", "default": 0 },
        "token_estimate": { "type": "integer", "minimum": 0, "default": 0 },
        "content_hash": { "type": "string", "minLength": 1 },
        "content": true,
        "evidence": {
          "type": "object",
          "required": ["authority"],
          "properties": {
            "authority": {
              "type": "string",
              "enum": [
                "user_confirmed",
                "source_fact",
                "deterministic_derived",
                "model_derived",
                "legacy_unknown"
              ]
            },
            "provenance": {
              "type": "object",
              "properties": {
                "source": { "type": "string" },
                "source_id": { "type": "string" },
                "source_event_id": { "type": "string" },
                "candidate_id": { "type": "string" },
                "algorithm_version": { "type": "string" },
                "observed_at": { "type": "string", "format": "date-time" }
              },
              "additionalProperties": false,
              "default": {}
            },
            "valid_from": { "type": "string", "format": "date-time" },
            "valid_until": { "type": "string", "format": "date-time" },
            "supersedes": { "type": "string", "minLength": 1 }
          },
          "additionalProperties": false
        },
        "metadata": { "type": "object", "default": {} }
      },
      "additionalProperties": false
    }
  }
}
