{
  "protocol_version": "agent.v1",
  "turn_id": "turn_1",
  "surface": "agent_tui",
  "mode": "natural_language",
  "session_id": "session_1",
  "thread_id": "thread_1",
  "agent_id": "ai_chat",
  "provider": "mock",
  "model": "mock-model",
  "messages": [
    {
      "role": "user",
      "content": "Read task task_1",
      "metadata": {}
    }
  ],
  "temperature": 0,
  "max_output_tokens": 128,
  "tools": [
    {
      "name": "read_task",
      "description": "Read a task",
      "input_schema": { "type": "object" },
      "output_schema": { "type": "object" },
      "risk": "read_only",
      "metadata": {}
    }
  ],
  "context_blocks": [
    {
      "block_id": "memory_preference_1",
      "kind": "memory",
      "source": "host.memory",
      "priority": 80,
      "token_estimate": 0,
      "content_hash": "host-recomputed",
      "content": {
        "statement": "User prefers concise answers",
        "authority": "user_confirmed"
      },
      "evidence": {
        "authority": "user_confirmed",
        "provenance": {
          "source": "settings_profile",
          "source_id": "preference_1"
        }
      },
      "metadata": {
        "trusted_as_instruction": false
      }
    }
  ],
  "metadata": {
    "source": "contract_test"
  },
  "max_tool_rounds": 4
}
